Sheet: Sheet1
B1: Start: | C1: End: | D1: Total: | E1: Sections:
B2: 26 | C2: 46 | D2: of:=[.C2]-[.B2] -> 20 | E2: 1.1 Writing a Simple C++ Program 1.2 A First Look at Input/Output 1.3 A Word about Comments 1.4 Flow of Control | F2: of:=[.E2]&" ("&[.D2]&"pp): "&[.H2] -> 1.1 Writing a Simple C++ Program
1.2 A First Look at Input/Output
1.3 A Word about Comments
1.4 Flow of Control (20pp): '4.36% | G2: Part I The Basics | H2: '4.36% | I2: 0.0436
B3: 47 | C3: 53 | D3: of:=[.C3]-[.B3] -> 6 | E3: 1.5 Introducing Classes 1.6 The Bookstore Program | F3: of:=[.E3]&" ("&[.D3]&"pp): "&[.H3] -> 1.5 Introducing Classes
1.6 The Bookstore Program (6pp): '5.03% | H3: '5.03% | I3: 0.0503
B4: 58 | C4: 71 | D4: of:=[.C4]-[.B4] -> 13 | E4: 2.1 Primitive Built-in Types | F4: of:=[.E4]&" ("&[.D4]&"pp): "&[.H4] -> 2.1 Primitive Built-in Types (13pp): '6.74% | H4: '6.74% | I4: 0.0674
B5: 72 | C5: 82 | D5: of:=[.C5]-[.B5] -> 10 | E5: 2.2 Variables | F5: of:=[.E5]&" ("&[.D5]&"pp): "&[.H5] -> 2.2 Variables (10pp): '7.78% | H5: '7.78% | I5: 0.0778
B6: 82 | C6: 94 | D6: of:=[.C6]-[.B6] -> 12 | E6: 2.3 Compound Types | F6: of:=[.E6]&" ("&[.D6]&"pp): "&[.H6] -> 2.3 Compound Types (12pp): '8.92% | H6: '8.92% | I6: 0.0892
B7: 94 | C7: 105 | D7: of:=[.C7]-[.B7] -> 11 | E7: 2.4 const Qualifier | F7: of:=[.E7]&" ("&[.D7]&"pp): "&[.H7] -> 2.4 const Qualifier (11pp): '9.96% | H7: '9.96% | I7: 0.0996
B8: 105 | C8: 111 | D8: of:=[.C8]-[.B8] -> 6 | E8: 2.5 Dealing with Types | F8: of:=[.E8]&" ("&[.D8]&"pp): "&[.H8] -> 2.5 Dealing with Types (6pp): '10.53% | H8: '10.53% | I8: 0.1053
B9: 111 | C9: 118 | D9: of:=[.C9]-[.B9] -> 7 | E9: 2.6 Defining Our Own Data Structures | F9: of:=[.E9]&" ("&[.D9]&"pp): "&[.H9] -> 2.6 Defining Our Own Data Structures (7pp): '11.20% | H9: '11.20% | I9: 0.112
B10: 123 | C10: 125 | D10: of:=[.C10]-[.B10] -> 2 | E10: 3.1 Namespace using Declarations | F10: of:=[.E10]&" ("&[.D10]&"pp): "&[.H10] -> 3.1 Namespace using Declarations (2pp): '11.86% | H10: '11.86% | I10: 0.1186
B11: 125 | C11: 141 | D11: of:=[.C11]-[.B11] -> 16 | E11: 3.2 Library string Type | F11: of:=[.E11]&" ("&[.D11]&"pp): "&[.H11] -> 3.2 Library string Type (16pp): '13.38% | H11: '13.38% | I11: 0.1338
B12: 141 | C12: 153 | D12: of:=[.C12]-[.B12] -> 12 | E12: 3.3 Library vector Type | F12: of:=[.E12]&" ("&[.D12]&"pp): "&[.H12] -> 3.3 Library vector Type (12pp): '14.52% | H12: '14.52% | I12: 0.1452
B13: 153 | C13: 162 | D13: of:=[.C13]-[.B13] -> 9 | E13: 3.4 Introducing Iterators | F13: of:=[.E13]&" ("&[.D13]&"pp): "&[.H13] -> 3.4 Introducing Iterators (9pp): '15.37% | H13: '15.37% | I13: 0.1537
B14: 162 | C14: 178 | D14: of:=[.C14]-[.B14] -> 16 | E14: 3.5 Arrays | F14: of:=[.E14]&" ("&[.D14]&"pp): "&[.H14] -> 3.5 Arrays (16pp): '16.89% | H14: '16.89% | I14: 0.1689
B15: 179 | C15: 185 | D15: of:=[.C15]-[.B15] -> 6 | E15: 3.6 Multidimensional Arrays | F15: of:=[.E15]&" ("&[.D15]&"pp): "&[.H15] -> 3.6 Multidimensional Arrays (6pp): '17.55% | H15: '17.55% | I15: 0.1755
B16: 188 | C16: 194 | D16: of:=[.C16]-[.B16] -> 6 | E16: 4.1 Fundamentals | F16: of:=[.E16]&" ("&[.D16]&"pp): "&[.H16] -> 4.1 Fundamentals (6pp): '18.41% | H16: '18.41% | I16: 0.1841
B17: 194 | C17: 197 | D17: of:=[.C17]-[.B17] -> 3 | E17: 4.2 Arithmetic Operators | F17: of:=[.E17]&" ("&[.D17]&"pp): "&[.H17] -> 4.2 Arithmetic Operators (3pp): '18.69% | H17: '18.69% | I17: 0.1869
B18: 197 | C18: 201 | D18: of:=[.C18]-[.B18] -> 4 | E18: 4.3 Logical and Relational Operators | F18: of:=[.E18]&" ("&[.D18]&"pp): "&[.H18] -> 4.3 Logical and Relational Operators (4pp): '19.07% | H18: '19.07% | I18: 0.1907
B19: 201 | C19: 205 | D19: of:=[.C19]-[.B19] -> 4 | E19: 4.4 Assignment Operators | F19: of:=[.E19]&" ("&[.D19]&"pp): "&[.H19] -> 4.4 Assignment Operators (4pp): '19.45% | H19: '19.45% | I19: 0.1945
B20: 205 | C20: 208 | D20: of:=[.C20]-[.B20] -> 3 | E20: 4.5 Increment and Decrement Operators | F20: of:=[.E20]&" ("&[.D20]&"pp): "&[.H20] -> 4.5 Increment and Decrement Operators (3pp): '19.73% | H20: '19.73% | I20: 0.1973
B21: 208 | C21: 209 | D21: of:=[.C21]-[.B21] -> 1 | E21: 4.6 The Member Access Operators | F21: of:=[.E21]&" ("&[.D21]&"pp): "&[.H21] -> 4.6 The Member Access Operators (1pp): '19.83% | H21: '19.83% | I21: 0.1983
B22: 209 | C22: 211 | D22: of:=[.C22]-[.B22] -> 2 | E22: 4.7 The Conditional Operator | F22: of:=[.E22]&" ("&[.D22]&"pp): "&[.H22] -> 4.7 The Conditional Operator (2pp): '20.02% | H22: '20.02% | I22: 0.2002
B23: 211 | C23: 216 | D23: of:=[.C23]-[.B23] -> 5 | E23: 4.8 The Bitwise Operators | F23: of:=[.E23]&" ("&[.D23]&"pp): "&[.H23] -> 4.8 The Bitwise Operators (5pp): '20.49% | H23: '20.49% | I23: 0.2049
B24: 216 | C24: 217 | D24: of:=[.C24]-[.B24] -> 1 | E24: 4.9 The sizeof Operator | F24: of:=[.E24]&" ("&[.D24]&"pp): "&[.H24] -> 4.9 The sizeof Operator (1pp): '20.59% | H24: '20.59% | I24: 0.2059
B25: 217 | C25: 219 | D25: of:=[.C25]-[.B25] -> 2 | E25: 4.10 Comma Operator | F25: of:=[.E25]&" ("&[.D25]&"pp): "&[.H25] -> 4.10 Comma Operator (2pp): '20.78% | H25: '20.78% | I25: 0.2078
B26: 219 | C26: 227 | D26: of:=[.C26]-[.B26] -> 8 | E26: 4.11 Type Conversions | F26: of:=[.E26]&" ("&[.D26]&"pp): "&[.H26] -> 4.11 Type Conversions (8pp): '21.54% | H26: '21.54% | I26: 0.2154
B27: 228 | C27: 230 | D27: of:=[.C27]-[.B27] -> 2 | E27: 4.12 Operator Precedence Table | F27: of:=[.E27]&" ("&[.D27]&"pp): "&[.H27] -> 4.12 Operator Precedence Table (2pp): '21.82% | H27: '21.82% | I27: 0.2182
B28: 233 | C28: 236 | D28: of:=[.C28]-[.B28] -> 3 | E28: 5.1 Simple Statements | F28: of:=[.E28]&" ("&[.D28]&"pp): "&[.H28] -> 5.1 Simple Statements (3pp): '22.39% | H28: '22.39% | I28: 0.2239
B29: 236 | C29: 237 | D29: of:=[.C29]-[.B29] -> 1 | E29: 5.2 Statement Scope | F29: of:=[.E29]&" ("&[.D29]&"pp): "&[.H29] -> 5.2 Statement Scope (1pp): '22.49% | H29: '22.49% | I29: 0.2249
B30: 237 | C30: 247 | D30: of:=[.C30]-[.B30] -> 10 | E30: 5.3 Conditional Statements | F30: of:=[.E30]&" ("&[.D30]&"pp): "&[.H30] -> 5.3 Conditional Statements (10pp): '23.43% | H30: '23.43% | I30: 0.2343
B31: 247 | C31: 256 | D31: of:=[.C31]-[.B31] -> 9 | E31: 5.4 Iterative Statements | F31: of:=[.E31]&" ("&[.D31]&"pp): "&[.H31] -> 5.4 Iterative Statements (9pp): '24.29% | H31: '24.29% | I31: 0.2429
B32: 256 | C32: 259 | D32: of:=[.C32]-[.B32] -> 3 | E32: 5.5 Jump Statements | F32: of:=[.E32]&" ("&[.D32]&"pp): "&[.H32] -> 5.5 Jump Statements (3pp): '24.57% | H32: '24.57% | I32: 0.2457
B33: 259 | C33: 265 | D33: of:=[.C33]-[.B33] -> 6 | E33: 5.6 try Blocks and Exception Handling | F33: of:=[.E33]&" ("&[.D33]&"pp): "&[.H33] -> 5.6 try Blocks and Exception Handling (6pp): '25.14% | H33: '25.14% | I33: 0.2514
B34: 268 | C34: 276 | D34: of:=[.C34]-[.B34] -> 8 | E34: 6.1 Function Basics | F34: of:=[.E34]&" ("&[.D34]&"pp): "&[.H34] -> 6.1 Function Basics (8pp): '26.19% | H34: '26.19% | I34: 0.2619
B35: 276 | C35: 293 | D35: of:=[.C35]-[.B35] -> 17 | E35: 6.2 Argument Passing | F35: of:=[.E35]&" ("&[.D35]&"pp): "&[.H35] -> 6.2 Argument Passing (17pp): '27.80% | H35: '27.80% | I35: 0.278
B36: 294 | C36: 303 | D36: of:=[.C36]-[.B36] -> 9 | E36: 6.3 Return Types and the return Statement | F36: of:=[.E36]&" ("&[.D36]&"pp): "&[.H36] -> 6.3 Return Types and the return Statement (9pp): '28.75% | H36: '28.75% | I36: 0.2875
B37: 303 | C37: 310 | D37: of:=[.C37]-[.B37] -> 7 | E37: 6.4 Overloaded Functions | F37: of:=[.E37]&" ("&[.D37]&"pp): "&[.H37] -> 6.4 Overloaded Functions (7pp): '29.41% | H37: '29.41% | I37: 0.2941
B38: 310 | C38: 318 | D38: of:=[.C38]-[.B38] -> 8 | E38: 6.5 Features for Specialized Uses | F38: of:=[.E38]&" ("&[.D38]&"pp): "&[.H38] -> 6.5 Features for Specialized Uses (8pp): '30.17% | H38: '30.17% | I38: 0.3017
B39: 318 | C39: 324 | D39: of:=[.C39]-[.B39] -> 6 | E39: 6.6 Function Matching | F39: of:=[.E39]&" ("&[.D39]&"pp): "&[.H39] -> 6.6 Function Matching (6pp): '30.74% | H39: '30.74% | I39: 0.3074
B40: 324 | C40: 329 | D40: of:=[.C40]-[.B40] -> 5 | E40: 6.7 Pointers to Functions | F40: of:=[.E40]&" ("&[.D40]&"pp): "&[.H40] -> 6.7 Pointers to Functions (5pp): '31.21% | H40: '31.21% | I40: 0.3121
B41: 332 | C41: 349 | D41: of:=[.C41]-[.B41] -> 17 | E41: 7.1 Defining Abstract Data Types | F41: of:=[.E41]&" ("&[.D41]&"pp): "&[.H41] -> 7.1 Defining Abstract Data Types (17pp): '33.11% | H41: '33.11% | I41: 0.3311
B42: 349 | C42: 353 | D42: of:=[.C42]-[.B42] -> 4 | E42: 7.2 Access Control and Encapsulation | F42: of:=[.E42]&" ("&[.D42]&"pp): "&[.H42] -> 7.2 Access Control and Encapsulation (4pp): '33.49% | H42: '33.49% | I42: 0.3349
B43: 353 | C43: 366 | D43: of:=[.C43]-[.B43] -> 13 | E43: 7.3 Additional Class Features | F43: of:=[.E43]&" ("&[.D43]&"pp): "&[.H43] -> 7.3 Additional Class Features (13pp): '34.72% | H43: '34.72% | I43: 0.3472
B44: 366 | C44: 373 | D44: of:=[.C44]-[.B44] -> 7 | E44: 7.4 Class Scope | F44: of:=[.E44]&" ("&[.D44]&"pp): "&[.H44] -> 7.4 Class Scope (7pp): '35.39% | H44: '35.39% | I44: 0.3539
B45: 373 | C45: 388 | D45: of:=[.C45]-[.B45] -> 15 | E45: 7.5 Constructors Revisited | F45: of:=[.E45]&" ("&[.D45]&"pp): "&[.H45] -> 7.5 Constructors Revisited (15pp): '36.81% | H45: '36.81% | I45: 0.3681
B46: 388 | C46: 394 | D46: of:=[.C46]-[.B46] -> 6 | E46: 7.6 static Class Members | F46: of:=[.E46]&" ("&[.D46]&"pp): "&[.H46] -> 7.6 static Class Members (6pp): '37.38% | H46: '37.38% | I46: 0.3738
B47: 397 | C47: 405 | D47: of:=[.C47]-[.B47] -> 8 | E47: 8.1 The IO Classes | F47: of:=[.E47]&" ("&[.D47]&"pp): "&[.H47] -> 8.1 The IO Classes (8pp): '38.43% | G47: Part II The C++ Library | H47: '38.43% | I47: 0.3843
B48: 405 | C48: 411 | D48: of:=[.C48]-[.B48] -> 6 | E48: 8.2 File Input and Output | F48: of:=[.E48]&" ("&[.D48]&"pp): "&[.H48] -> 8.2 File Input and Output (6pp): '38.99% | H48: '38.99% | I48: 0.3899
B49: 411 | C49: 415 | D49: of:=[.C49]-[.B49] -> 4 | E49: 8.3 string Streams | F49: of:=[.E49]&" ("&[.D49]&"pp): "&[.H49] -> 8.3 string Streams (4pp): '39.37% | H49: '39.37% | I49: 0.3937
B50: 416 | C50: 420 | D50: of:=[.C50]-[.B50] -> 4 | E50: 9.1 Overview of the Sequential Containers | F50: of:=[.E50]&" ("&[.D50]&"pp): "&[.H50] -> 9.1 Overview of the Sequential Containers (4pp): '39.85% | H50: '39.85% | I50: 0.3985
B51: 420 | C51: 435 | D51: of:=[.C51]-[.B51] -> 15 | E51: 9.2 Container Library Overview | F51: of:=[.E51]&" ("&[.D51]&"pp): "&[.H51] -> 9.2 Container Library Overview (15pp): '41.27% | H51: '41.27% | I51: 0.4127
B52: 435 | C52: 452 | D52: of:=[.C52]-[.B52] -> 17 | E52: 9.3 Sequential Container Operations | F52: of:=[.E52]&" ("&[.D52]&"pp): "&[.H52] -> 9.3 Sequential Container Operations (17pp): '42.88% | H52: '42.88% | I52: 0.4288
B53: 452 | C53: 457 | D53: of:=[.C53]-[.B53] -> 5 | E53: 9.4 How a vector Grows | F53: of:=[.E53]&" ("&[.D53]&"pp): "&[.H53] -> 9.4 How a vector Grows (5pp): '43.36% | H53: '43.36% | I53: 0.4336
B54: 457 | C54: 468 | D54: of:=[.C54]-[.B54] -> 11 | E54: 9.5 Additional string Operations | F54: of:=[.E54]&" ("&[.D54]&"pp): "&[.H54] -> 9.5 Additional string Operations (11pp): '44.40% | H54: '44.40% | I54: 0.444
B55: 468 | C55: 472 | D55: of:=[.C55]-[.B55] -> 4 | E55: 9.6 Container Adaptors | F55: of:=[.E55]&" ("&[.D55]&"pp): "&[.H55] -> 9.6 Container Adaptors (4pp): '44.78% | H55: '44.78% | I55: 0.4478
B56: 474 | C56: 477 | D56: of:=[.C56]-[.B56] -> 3 | E56: 10.1 Overview | F56: of:=[.E56]&" ("&[.D56]&"pp): "&[.H56] -> 10.1 Overview (3pp): '45.26% | H56: '45.26% | I56: 0.4526
B57: 477 | C57: 486 | D57: of:=[.C57]-[.B57] -> 9 | E57: 10.2 A First Look at the Algorithms | F57: of:=[.E57]&" ("&[.D57]&"pp): "&[.H57] -> 10.2 A First Look at the Algorithms (9pp): '46.11% | H57: '46.11% | I57: 0.4611
B58: 487 | C58: 506 | D58: of:=[.C58]-[.B58] -> 19 | E58: 10.3 Customizing Operations | F58: of:=[.E58]&" ("&[.D58]&"pp): "&[.H58] -> 10.3 Customizing Operations (19pp): '48.01% | H58: '48.01% | I58: 0.4801
B59: 506 | C59: 516 | D59: of:=[.C59]-[.B59] -> 10 | E59: 10.4 Revisiting Iterators | F59: of:=[.E59]&" ("&[.D59]&"pp): "&[.H59] -> 10.4 Revisiting Iterators (10pp): '48.96% | H59: '48.96% | I59: 0.4896
B60: 517 | C60: 522 | D60: of:=[.C60]-[.B60] -> 5 | E60: 10.5 Structure of Generic Algorithms | F60: of:=[.E60]&" ("&[.D60]&"pp): "&[.H60] -> 10.5 Structure of Generic Algorithms (5pp): '49.53% | H60: '49.53% | I60: 0.4953
B61: 523 | C61: 525 | D61: of:=[.C61]-[.B61] -> 2 | E61: 10.6 Container-Specific Algorithms | F61: of:=[.E61]&" ("&[.D61]&"pp): "&[.H61] -> 10.6 Container-Specific Algorithms (2pp): '49.81% | H61: '49.81% | I61: 0.4981
B62: 527 | C62: 531 | D62: of:=[.C62]-[.B62] -> 4 | E62: 11.1 Using an Associative Container | F62: of:=[.E62]&" ("&[.D62]&"pp): "&[.H62] -> 11.1 Using an Associative Container (4pp): '50.38% | H62: '50.38% | I62: 0.5038
B63: 531 | C63: 537 | D63: of:=[.C63]-[.B63] -> 6 | E63: 11.2 Overview of the Associative Containers | F63: of:=[.E63]&" ("&[.D63]&"pp): "&[.H63] -> 11.2 Overview of the Associative Containers (6pp): '50.95% | H63: '50.95% | I63: 0.5095
B64: 537 | C64: 555 | D64: of:=[.C64]-[.B64] -> 18 | E64: 11.3 Operations on Associative Containers | F64: of:=[.E64]&" ("&[.D64]&"pp): "&[.H64] -> 11.3 Operations on Associative Containers (18pp): '52.66% | H64: '52.66% | I64: 0.5266
B65: 555 | C65: 560 | D65: of:=[.C65]-[.B65] -> 5 | E65: 11.4 The Unordered Containers | F65: of:=[.E65]&" ("&[.D65]&"pp): "&[.H65] -> 11.4 The Unordered Containers (5pp): '53.13% | H65: '53.13% | I65: 0.5313
B66: 562 | C66: 595 | D66: of:=[.C66]-[.B66] -> 33 | E66: 12.1 Dynamic Memory and Smart Pointers | F66: of:=[.E66]&" ("&[.D66]&"pp): "&[.H66] -> 12.1 Dynamic Memory and Smart Pointers (33pp): '56.45% | H66: '56.45% | I66: 0.5645
B67: 595 | C67: 605 | D67: of:=[.C67]-[.B67] -> 10 | E67: 12.2 Dynamic Arrays | F67: of:=[.E67]&" ("&[.D67]&"pp): "&[.H67] -> 12.2 Dynamic Arrays (10pp): '57.40% | H67: '57.40% | I67: 0.574
B68: 605 | C68: 613 | D68: of:=[.C68]-[.B68] -> 8 | E68: 12.3 Using the Library: A Text-Query Program | F68: of:=[.E68]&" ("&[.D68]&"pp): "&[.H68] -> 12.3 Using the Library: A Text-Query Program (8pp): '58.16% | H68: '58.16% | I68: 0.5816
B69: 614 | C69: 634 | D69: of:=[.C69]-[.B69] -> 20 | E69: 13.1 Copy, Assign, and Destroy | F69: of:=[.E69]&" ("&[.D69]&"pp): "&[.H69] -> 13.1 Copy, Assign, and Destroy (20pp): '60.15% | G69: Part III Tools for Class Authors | H69: '60.15% | I69: 0.6015
B70: 634 | C70: 641 | D70: of:=[.C70]-[.B70] -> 7 | E70: 13.2 Copy Control and Resource Management | F70: of:=[.E70]&" ("&[.D70]&"pp): "&[.H70] -> 13.2 Copy Control and Resource Management (7pp): '60.82% | H70: '60.82% | I70: 0.6082
B71: 641 | C71: 645 | D71: of:=[.C71]-[.B71] -> 4 | E71: 13.3 Swap | F71: of:=[.E71]&" ("&[.D71]&"pp): "&[.H71] -> 13.3 Swap (4pp): '61.20% | H71: '61.20% | I71: 0.612
B72: 645 | C72: 650 | D72: of:=[.C72]-[.B72] -> 5 | E72: 13.4 A Copy-Control Example | F72: of:=[.E72]&" ("&[.D72]&"pp): "&[.H72] -> 13.4 A Copy-Control Example (5pp): '61.67% | H72: '61.67% | I72: 0.6167
B73: 650 | C73: 658 | D73: of:=[.C73]-[.B73] -> 8 | E73: 13.5 Classes That Manage Dynamic Memory | F73: of:=[.E73]&" ("&[.D73]&"pp): "&[.H73] -> 13.5 Classes That Manage Dynamic Memory (8pp): '62.43% | H73: '62.43% | I73: 0.6243
B74: 658 | C74: 680 | D74: of:=[.C74]-[.B74] -> 22 | E74: 13.6 Moving Objects | F74: of:=[.E74]&" ("&[.D74]&"pp): "&[.H74] -> 13.6 Moving Objects (22pp): '64.52% | H74: '64.52% | I74: 0.6452
B75: 682 | C75: 689 | D75: of:=[.C75]-[.B75] -> 7 | E75: 14.1 Basic Concepts | F75: of:=[.E75]&" ("&[.D75]&"pp): "&[.H75] -> 14.1 Basic Concepts (7pp): '65.37% | H75: '65.37% | I75: 0.6537
B76: 689 | C76: 694 | D76: of:=[.C76]-[.B76] -> 5 | E76: 14.2 Input and Output Operators | F76: of:=[.E76]&" ("&[.D76]&"pp): "&[.H76] -> 14.2 Input and Output Operators (5pp): '65.84% | H76: '65.84% | I76: 0.6584
B77: 694 | C77: 697 | D77: of:=[.C77]-[.B77] -> 3 | E77: 14.3 Arithmetic and Relational Operators | F77: of:=[.E77]&" ("&[.D77]&"pp): "&[.H77] -> 14.3 Arithmetic and Relational Operators (3pp): '66.13% | H77: '66.13% | I77: 0.6613
B78: 697 | C78: 699 | D78: of:=[.C78]-[.B78] -> 2 | E78: 14.4 Assignment Operators | F78: of:=[.E78]&" ("&[.D78]&"pp): "&[.H78] -> 14.4 Assignment Operators (2pp): '66.32% | H78: '66.32% | I78: 0.6632
B79: 699 | C79: 701 | D79: of:=[.C79]-[.B79] -> 2 | E79: 14.5 Subscript Operator | F79: of:=[.E79]&" ("&[.D79]&"pp): "&[.H79] -> 14.5 Subscript Operator (2pp): '66.51% | H79: '66.51% | I79: 0.6651
B80: 701 | C80: 704 | D80: of:=[.C80]-[.B80] -> 3 | E80: 14.6 Increment and Decrement Operators | F80: of:=[.E80]&" ("&[.D80]&"pp): "&[.H80] -> 14.6 Increment and Decrement Operators (3pp): '66.79% | H80: '66.79% | I80: 0.6679
B81: 704 | C81: 706 | D81: of:=[.C81]-[.B81] -> 2 | E81: 14.7 Member Access Operators | F81: of:=[.E81]&" ("&[.D81]&"pp): "&[.H81] -> 14.7 Member Access Operators (2pp): '66.98% | H81: '66.98% | I81: 0.6698
B82: 707 | C82: 717 | D82: of:=[.C82]-[.B82] -> 10 | E82: 14.8 Function-Call Operator | F82: of:=[.E82]&" ("&[.D82]&"pp): "&[.H82] -> 14.8 Function-Call Operator (10pp): '68.03% | H82: '68.03% | I82: 0.6803
B83: 717 | C83: 730 | D83: of:=[.C83]-[.B83] -> 13 | E83: 14.9 Overloading, Conversions, and Operators | F83: of:=[.E83]&" ("&[.D83]&"pp): "&[.H83] -> 14.9 Overloading, Conversions, and Operators (13pp): '69.26% | H83: '69.26% | I83: 0.6926
B84: 731 | C84: 734 | D84: of:=[.C84]-[.B84] -> 3 | E84: 15.1 OOP: An Overview | F84: of:=[.E84]&" ("&[.D84]&"pp): "&[.H84] -> 15.1 OOP: An Overview (3pp): '69.64% | H84: '69.64% | I84: 0.6964
B85: 734 | C85: 746 | D85: of:=[.C85]-[.B85] -> 12 | E85: 15.2 Defining Base and Derived Classes | F85: of:=[.E85]&" ("&[.D85]&"pp): "&[.H85] -> 15.2 Defining Base and Derived Classes (12pp): '70.78% | H85: '70.78% | I85: 0.7078
B86: 746 | C86: 752 | D86: of:=[.C86]-[.B86] -> 6 | E86: 15.3 Virtual Functions | F86: of:=[.E86]&" ("&[.D86]&"pp): "&[.H86] -> 15.3 Virtual Functions (6pp): '71.35% | H86: '71.35% | I86: 0.7135
B87: 752 | C87: 755 | D87: of:=[.C87]-[.B87] -> 3 | E87: 15.4 Abstract Base Classes | F87: of:=[.E87]&" ("&[.D87]&"pp): "&[.H87] -> 15.4 Abstract Base Classes (3pp): '71.63% | H87: '71.63% | I87: 0.7163
B88: 755 | C88: 762 | D88: of:=[.C88]-[.B88] -> 7 | E88: 15.5 Access Control and Inheritance | F88: of:=[.E88]&" ("&[.D88]&"pp): "&[.H88] -> 15.5 Access Control and Inheritance (7pp): '72.30% | H88: '72.30% | I88: 0.723
B89: 762 | C89: 768 | D89: of:=[.C89]-[.B89] -> 6 | E89: 15.6 Class Scope under Inheritance | F89: of:=[.E89]&" ("&[.D89]&"pp): "&[.H89] -> 15.6 Class Scope under Inheritance (6pp): '72.87% | H89: '72.87% | I89: 0.7287
B90: 768 | C90: 778 | D90: of:=[.C90]-[.B90] -> 10 | E90: 15.7 Constructors and Copy Control | F90: of:=[.E90]&" ("&[.D90]&"pp): "&[.H90] -> 15.7 Constructors and Copy Control (10pp): '73.81% | H90: '73.81% | I90: 0.7381
B91: 778 | C91: 783 | D91: of:=[.C91]-[.B91] -> 5 | E91: 15.8 Containers and Inheritance | F91: of:=[.E91]&" ("&[.D91]&"pp): "&[.H91] -> 15.8 Containers and Inheritance (5pp): '74.29% | H91: '74.29% | I91: 0.7429
B92: 783 | C92: 800 | D92: of:=[.C92]-[.B92] -> 17 | E92: 15.9 Text Queries Revisited | F92: of:=[.E92]&" ("&[.D92]&"pp): "&[.H92] -> 15.9 Text Queries Revisited (17pp): '75.90% | H92: '75.90% | I92: 0.759
B93: 802 | C93: 836 | D93: of:=[.C93]-[.B93] -> 34 | E93: 16.1 Defining a Template | F93: of:=[.E93]&" ("&[.D93]&"pp): "&[.H93] -> 16.1 Defining a Template (34pp): '79.32% | H93: '79.32% | I93: 0.7932
B94: 836 | C94: 856 | D94: of:=[.C94]-[.B94] -> 20 | E94: 16.2 Template Argument Deduction | F94: of:=[.E94]&" ("&[.D94]&"pp): "&[.H94] -> 16.2 Template Argument Deduction (20pp): '81.21% | H94: '81.21% | I94: 0.8121
B95: 857 | C95: 862 | D95: of:=[.C95]-[.B95] -> 5 | E95: 16.3 Overloading and Templates | F95: of:=[.E95]&" ("&[.D95]&"pp): "&[.H95] -> 16.3 Overloading and Templates (5pp): '81.78% | H95: '81.78% | I95: 0.8178
B96: 862 | C96: 871 | D96: of:=[.C96]-[.B96] -> 9 | E96: 16.4 Variadic Templates | F96: of:=[.E96]&" ("&[.D96]&"pp): "&[.H96] -> 16.4 Variadic Templates (9pp): '82.64% | H96: '82.64% | I96: 0.8264
B97: 871 | C97: 879 | D97: of:=[.C97]-[.B97] -> 8 | E97: 16.5 Template Specializations | F97: of:=[.E97]&" ("&[.D97]&"pp): "&[.H97] -> 16.5 Template Specializations (8pp): '83.40% | H97: '83.40% | I97: 0.834
B98: 881 | C98: 889 | D98: of:=[.C98]-[.B98] -> 8 | E98: 17.1 The tuple Type | F98: of:=[.E98]&" ("&[.D98]&"pp): "&[.H98] -> 17.1 The tuple Type (8pp): '84.35% | G98: Part IV: Advanced Topics | H98: '84.35% | I98: 0.8435
B99: 889 | C99: 896 | D99: of:=[.C99]-[.B99] -> 7 | E99: 17.2 The bitset Type | F99: of:=[.E99]&" ("&[.D99]&"pp): "&[.H99] -> 17.2 The bitset Type (7pp): '85.01% | H99: '85.01% | I99: 0.8501
B100: 896 | C100: 915 | D100: of:=[.C100]-[.B100] -> 19 | E100: 17.3 Regular Expressions | F100: of:=[.E100]&" ("&[.D100]&"pp): "&[.H100] -> 17.3 Regular Expressions (19pp): '86.81% | H100: '86.81% | I100: 0.8681
B101: 915 | C101: 924 | D101: of:=[.C101]-[.B101] -> 9 | E101: 17.4 Random Numbers | F101: of:=[.E101]&" ("&[.D101]&"pp): "&[.H101] -> 17.4 Random Numbers (9pp): '87.67% | H101: '87.67% | I101: 0.8767
B102: 924 | C102: 944 | D102: of:=[.C102]-[.B102] -> 20 | E102: 17.5 The IO Library Revisited | F102: of:=[.E102]&" ("&[.D102]&"pp): "&[.H102] -> 17.5 The IO Library Revisited (20pp): '89.56% | H102: '89.56% | I102: 0.8956
B103: 946 | C103: 962 | D103: of:=[.C103]-[.B103] -> 16 | E103: 18.1 Exception Handling | F103: of:=[.E103]&" ("&[.D103]&"pp): "&[.H103] -> 18.1 Exception Handling (16pp): '91.27% | H103: '91.27% | I103: 0.9127
B104: 962 | C104: 983 | D104: of:=[.C104]-[.B104] -> 21 | E104: 18.2 Namespaces | F104: of:=[.E104]&" ("&[.D104]&"pp): "&[.H104] -> 18.2 Namespaces (21pp): '93.26% | H104: '93.26% | I104: 0.9326
B105: 983 | C105: 999 | D105: of:=[.C105]-[.B105] -> 16 | E105: 18.3 Multiple and Virtual Inheritance | F105: of:=[.E105]&" ("&[.D105]&"pp): "&[.H105] -> 18.3 Multiple and Virtual Inheritance (16pp): '94.78% | H105: '94.78% | I105: 0.9478
B106: 1002 | C106: 1009 | D106: of:=[.C106]-[.B106] -> 7 | E106: 19.1 Controlling Memory Allocation | F106: of:=[.E106]&" ("&[.D106]&"pp): "&[.H106] -> 19.1 Controlling Memory Allocation (7pp): '95.73% | H106: '95.73% | I106: 0.9573
B107: 1009 | C107: 1018 | D107: of:=[.C107]-[.B107] -> 9 | E107: 19.2 Run-Time Type Identification | F107: of:=[.E107]&" ("&[.D107]&"pp): "&[.H107] -> 19.2 Run-Time Type Identification (9pp): '96.58% | H107: '96.58% | I107: 0.9658
B108: 1018 | C108: 1022 | D108: of:=[.C108]-[.B108] -> 4 | E108: 19.3 Enumerations | F108: of:=[.E108]&" ("&[.D108]&"pp): "&[.H108] -> 19.3 Enumerations (4pp): '96.96% | H108: '96.96% | I108: 0.9696
B109: 1022 | C109: 1032 | D109: of:=[.C109]-[.B109] -> 10 | E109: 19.4 Pointer to Class Member | F109: of:=[.E109]&" ("&[.D109]&"pp): "&[.H109] -> 19.4 Pointer to Class Member (10pp): '97.91% | H109: '97.91% | I109: 0.9791
B110: 1032 | C110: 1036 | D110: of:=[.C110]-[.B110] -> 4 | E110: 19.5 Nested Classes | F110: of:=[.E110]&" ("&[.D110]&"pp): "&[.H110] -> 19.5 Nested Classes (4pp): '98.29% | H110: '98.29% | I110: 0.9829
B111: 1036 | C111: 1042 | D111: of:=[.C111]-[.B111] -> 6 | E111: 19.6 union: A Space-Saving Class | F111: of:=[.E111]&" ("&[.D111]&"pp): "&[.H111] -> 19.6 union: A Space-Saving Class (6pp): '98.86% | H111: '98.86% | I111: 0.9886
B112: 1042 | C112: 1045 | D112: of:=[.C112]-[.B112] -> 3 | E112: 19.7 Local Classes | F112: of:=[.E112]&" ("&[.D112]&"pp): "&[.H112] -> 19.7 Local Classes (3pp): '99.15% | H112: '99.15% | I112: 0.9915
B113: 1045 | C113: 1054 | D113: of:=[.C113]-[.B113] -> 9 | E113: 19.8 Inherently Nonportable Features | F113: of:=[.E113]&" ("&[.D113]&"pp): "&[.H113] -> 19.8 Inherently Nonportable Features (9pp): '100.00% | H113: '100.00% | I113: 1